nl,code
"if features.needs_datetime_string_cast field of the object represented stored under the db key of connections dictionary is true,","if connections [ db ] . features . needs_datetime_string_cast and not isinstance ( expires , datetime ) :"
"and expires is not an instance of datetime. convert expires to a string, use it as argument for the call to the function typecast_timestamp, substitute the result for expires.",expires = typecast_timestamp ( str ( expires ) )
"if expires is lesser than now,",if expires < now :
"call the method router.db_for_write with argument self.cache_model_class, substitute the result for db.",db = router . db_for_write ( self . cache_model_class )
"call the cursor method on the value under the db key of connections dictionary, preform following with return value named cursor,",with connections [ db ] . cursor ( ) as cursor :
"call the method cursor.execute with string ""DELETE FROM %s WHERE cache_key = %%s"" as argument,","cursor . execute ( ""DELETE FROM %s "" ""WHERE cache_key = %%s"" % table , [ key ] )"
"substitute the '%s' with table and list containing key, respectively. return default.",return default
"call the method ops.process_clob with second element of row as argument, on the object under the db key of connections dictionary, substitute the result for value.",value = connections [ db ] . ops . process_clob ( row [ 1 ] )
"call the function force_bytes with argument value, use the result as an argument for the call to the method base64.b64decode,",return pickle . loads ( base64 . b64decode ( force_bytes ( value ) ) )
"use the result as the argument for the function call to the pickle.loads, return the result. define the method set with 5 arguments, self class instance, key, value, timeout set to DEFAULT_TIMEOUT and version set to None.","def set ( self , key , value , timeout = DEFAULT_TIMEOUT , version = None ) :"
"call the method self.make_key with key and version set to version as arguments, substitute the result for key.","key = self . make_key ( key , version = version )"
call the method self.validate_key with key as argument.,self . validate_key ( key )
"call the method self._base_set with string 'set', key, value and timeout as arguments.","self . _base_set ( 'set' , key , value , timeout )"
"define the method add with 5 arguments, self class instance, key, value, timeout set to DEFAULT_TIMEOUT and version set to None.","def add ( self , key , value , timeout = DEFAULT_TIMEOUT , version = None ) :"
"call the method self.make_key with key and version set to version as arguments, substitute the result for key.","key = self . make_key ( key , version = version )"
call the method self.validate_key with key as argument.,self . validate_key ( key )
"call the method self._base_set with string 'add', key, value and timeout as arguments, return the result.","return self . _base_set ( 'add' , key , value , timeout )"
"define the protected method _base_set with 4 arguments, self class instance, key, value and timeout set to DEFAULT_TIMEOUT.","def _base_set ( self , mode , key , value , timeout = DEFAULT_TIMEOUT ) :"
"call the method self.get_backend_timeout with argument timeout, substitute the result for timeout.",timeout = self . get_backend_timeout ( timeout )
"call the method router.db_for_write with argument self.cache_model_class, substitute the result for db.",db = router . db_for_write ( self . cache_model_class )
"call the ops.quote_name method with argument self._table on the object under the db key of connections dictionary, substitute the result for table.",table = connections [ db ] . ops . quote_name ( self . _table )
"call the cursor method on the value under the db key of connections dictionary, preform following with return value named cursor,",with connections [ db ] . cursor ( ) as cursor :
"call the method cursor.execute with string ""SELECT COUNT(*) FROM %s"" as argument, substitute the '%s' with table.","cursor . execute ( ""SELECT COUNT(*) FROM %s"" % table )"
"fetch one record from the database cursor points at, substitute the first element of return value for num.",num = cursor . fetchone ( ) [ 0 ]
"call the timezone.now function, substitute the result for now.",now = timezone . now ( )
"call the function now.replace with microseconds set to integer 0, substitute the result for now.",now = now . replace ( microsecond = 0 )
"if timeout is None,",if timeout is None :
substitute the datetime.max for exp.,exp = datetime . max
"otherwise is settings.USE_TI is true,",elif settings . USE_TZ :
"call the function datetime.utcfromtimestamp with argument timeout, substitute it for exp.",exp = datetime . utcfromtimestamp ( timeout )
"if not,",else :
"call the function datetime.fromtimestamp with argument timeout, substitute it for exp.",exp = datetime . fromtimestamp ( timeout )
"call the exp.replace with microsecond set to integer 0, substitute the result for exp.",exp = exp . replace ( microsecond = 0 )
"if num is greater than self._max_entries,",if num > self . _max_entries :
"call the method self._cull with db, cursor and now as arguments.","self . _cull ( db , cursor , now )"
"call the method pickle.dumps with value and pickle.HIGHEST_PROTOCOL as arguments, substitute it for pickled.","pickled = pickle . dumps ( value , pickle . HIGHEST_PROTOCOL )"
"call the method base64.b64encode with argument pickled, substitute the result for b64encoded.",b64encoded = base64 . b64encode ( pickled )
"if six.PY3 is true,",if six . PY3 :
"call the method b64encoded.decode with string 'latin1' as argument, substitute the result for b64encoded.",b64encoded = b64encoded . decode ( 'latin1' )
"try,",try :
"with return value of the function transaction.atomic with using set to db as arguments, perform the following,",with transaction . atomic ( using = db ) :
"call the method cursor.execute with string ""SELECT cache_key, expires FROM %s WHERE cache_key = %%s"" as argument,","cursor . execute ( ""SELECT cache_key, expires FROM %s "" ""WHERE cache_key = %%s"" % table , [ key ] )"
"substitute the '%s' with table and list containing key, respectively. fetch one entry from the database that cursor points at, substitute it for the result.",result = cursor . fetchone ( )
"if result is true,",if result :
substitute the second element of result for current_expires.,current_expires = result [ 1 ]
if features.needs_datetime_string_cast field of object under the db key of connections dictionary is true and current_expires is not an instance of datetime object.,"if ( connections [ db ] . features . needs_datetime_string_cast and not isinstance ( current_expires , datetime ) ) :"
"convert current_expires to a string, use it as the argument for the call to the function typecast_timestamp, substitute the result for current_expires.",current_expires = typecast_timestamp ( str ( current_expires ) )
"on the object under the db key of connections dictionary call the method ops.value_to_db_datetime with argument exp, substitute the result for the exp.",exp = connections [ db ] . ops . value_to_db_datetime ( exp )
"if mode equals to string 'add' and current_expires is lesser than now, or mode equals to string 'set', and result is true,",if result and ( mode == 'set' or ( mode == 'add' and current_expires < now ) ) :
"call the method cursor.execute with string ""UPDATE %s SET value = %%s, expires = %%s WHERE cache_key = %%s"" as argument,","cursor . execute ( ""UPDATE %s SET value = %%s, expires = %%s "" ""WHERE cache_key = %%s"" % table , [ b64encoded , exp , key ] )"
"substitute the '%s' with table and 3 elements of a list: b64encoded, exp and key, respectively. if not,",else :
"call the method cursor.execute with string ""INSERT INTO %s (cache_key, value, expires) VALUES (%%s, %%s, %%s)"",","cursor . execute ( ""INSERT INTO %s (cache_key, value, expires) "" ""VALUES (%%s, %%s, %%s)"" % table , [ key , b64encoded , exp ] )"
"substitute the '%s' with table and 3 elements of a list: b64encoded, exp and key, respectively. if DatabaseError exception is caught,",except DatabaseError :
return boolean False.,return False
"if not,",else :
return boolean True.,return True
"define the method delete with self class instance, key and version set to None as arguments.","def delete ( self , key , version = None ) :"
"call the method self.make_key with key and version set to version as arguments, substitute the result for key.","key = self . make_key ( key , version = version )"
call the method self.validate_key with argument key.,self . validate_key ( key )
"call the method router.db_for_write with argument self.cache_model_class, substitute the result for db.",db = router . db_for_write ( self . cache_model_class )
"call the ops.quote_name method with argument self._table on the object under the db key of connections dictionary, substitute the result for table.",table = connections [ db ] . ops . quote_name ( self . _table )
"call the cursor method on the value under the db key of connections dictionary, preform following with return value named cursor,",with connections [ db ] . cursor ( ) as cursor :
"call the method cursor.execute with string ""DELETE FROM %s WHERE cache_key = %%s"" as argument,","cursor . execute ( ""DELETE FROM %s WHERE cache_key = %%s"" % table , [ key ] )"
"substitute the '%s' with table and list containing key, respectively. define the method has_key with self class instance, key and version defaulting to None as arguments.","def has_key ( self , key , version = None ) :"
"call the self.make_key with key and version set to version as arguments, substitute the result for key.","key = self . make_key ( key , version = version )"
call the self.validate_key method with argument key.,self . validate_key ( key )
"call the method router.db_for_write with argument self.cache_model_class, substitute the result for db.",db = router . db_for_read ( self . cache_model_class )
"call the ops.quote_name method with argument self._table on the object under the db key of connections dictionary, substitute the result for table.",table = connections [ db ] . ops . quote_name ( self . _table )
"if settings.USE_TZ is true,",if settings . USE_TZ :
"call the function datetime.utcnow, substitute the result for now.",now = datetime . utcnow ( )
"if not,",else :
"call the function datetime.now, substitute the result to now.",now = datetime . now ( )
"call the method now.replace with the argument microsecond set to integer 0, substitute the result for now.",now = now . replace ( microsecond = 0 )
"call the cursor method on the value under the db key of connections dictionary, preform following with return value named cursor,",with connections [ db ] . cursor ( ) as cursor :
"call the method cursor.execute with string ""SELECT cache_key FROM %s WHERE cache_key = %%s and expires > %%s"" as argument,","cursor . execute ( ""SELECT cache_key FROM %s "" ""WHERE cache_key = %%s and expires > %%s"" % table , [ key , connections [ db ] . ops . value_to_db_datetime ( now ) ] )"
"substitute the '%s' with table and list containing return value of the method call ops.value_to_db_datetime with argument now on the object under the db key of connections dictionary, respectively. if exists return next entry from the database that cursor points at.",return cursor . fetchone ( ) is not None
"define the protected method _cull with self class instance, db, cursor and now as arguments.","def _cull ( self , db , cursor , now ) :"
if self._cull_frequency equals to integer 0.,if self . _cull_frequency == 0 :
call the self.clear method.,self . clear ( )
"if not,",else :
"call the method now.replace with argument tzinfo set to None, substitute it for now.",now = now . replace ( tzinfo = None )
"call the ops.quote_name method with argument self._table on the object under the db key of connections dictionary, substitute the result for table.",table = connections [ db ] . ops . quote_name ( self . _table )
"call the method cursor.execute with string ""DELETE FROM %s WHERE expires < %%s"" as argument,","cursor . execute ( ""DELETE FROM %s WHERE expires < %%s"" % table , [ connections [ db ] . ops . value_to_db_datetime ( now ) ] )"
"substitute the '%s' with table and list containing return value of the method call ops.value_to_db_datetime with argument now on the object under the db key of connections dictionary, respectively. call the method cursor.execute with string ""SELECT COUNT(*) FROM %s"" as argument, substitute the '%s' with table.","cursor . execute ( ""SELECT COUNT(*) FROM %s"" % table )"
"fetch next entry for the database that cursor points into, substitute first element of it for num.",num = cursor . fetchone ( ) [ 0 ]
"if num is greater than self._max_entries,",if num > self . _max_entries :
"divide num by self._cull_frequency, floor the result and substitute it for cull_num.",cull_num = num // self . _cull_frequency
"evaluate the method connections[db].ops.cache_key_culling_sql, evaluate the result by table modulus, call the method cursor.execute,","cursor . execute ( connections [ db ] . ops . cache_key_culling_sql ( ) % table , [ cull_num ] )"
"with previous result and list containing cull_num, respectively as arguments. call the method cursor.execute with string ""DELETE FROM %s WHERE cache_key < %%s"" as argument,","cursor . execute ( ""DELETE FROM %s "" ""WHERE cache_key < %%s"" % table , [ cursor . fetchone ( ) [ 0 ] ] )"
"substitute the '%s' with table and list containing first element of cursor.fetchone method, respectively. define the method clear with argument self.",def clear ( self ) :
"call the method router.db_for_write with argument self.cache_model_class, substitute the result for db.",db = router . db_for_write ( self . cache_model_class )
"call the ops.quote_name method with argument self._table on the object under the db key of connections dictionary, substitute the result for table.",table = connections [ db ] . ops . quote_name ( self . _table )
"call the cursor method on the value under the db key of connections dictionary, preform following with return value named cursor,",with connections [ db ] . cursor ( ) as cursor :
"call the method cursor.execute with string ""DELETE FROM %s"" as argument, substitute the '%s' with table.",cursor . execute ( 'DELETE FROM %s' % table )
derive the class CacheClass from the DatabaseCache base class.,class CacheClass ( DatabaseCache ) :
do nothing.,pass
from django.core.cache.backends.base import BaseCache and DEFAULT_TIMEOUT into default name space.,"from django . core . cache . backends . base import BaseCache , DEFAULT_TIMEOUT"
derive the class DummyCache from the base class BaseCache.,class DummyCache ( BaseCache ) :
"define initialization method __init__ with 4 arguments: self, host, list of arguments args and dictionary of arguments kwargs.","def __init__ ( self , host , * args , ** kwargs ) :"
"call the BaseCache initialization method __init__ with 3 arguments self, list of arguments args and dictionary of arguments kwargs.","BaseCache . __init__ ( self , * args , ** kwargs )"
"define the method add with 5 arguments: self, key, value, timeout set to DEFAULT_TIMEOUT and version set to None.","def add ( self , key , value , timeout = DEFAULT_TIMEOUT , version = None ) :"
"call the method self.make_key with key and version set to version as arguments, substitute it for key.","key = self . make_key ( key , version = version )"
call the method self.validate_key with argument key.,self . validate_key ( key )
return boolean True.,return True
"define the method get with 4 arguments: self, key, default set to None and version set to None.","def get ( self , key , default = None , version = None ) :"
"call the method self.make_key with key and version set to version as arguments, substitute it for key.","key = self . make_key ( key , version = version )"
call the method self.validate_key with argument key.,self . validate_key ( key )
return default.,return default
"define the method set with 5 arguments: self, key, value, timeout set to DEFAULT_TIMEOUT and version set to None.","def set ( self , key , value , timeout = DEFAULT_TIMEOUT , version = None ) :"
"call the method self.make_key with key and version set to version as arguments, substitute it for key.","key = self . make_key ( key , version = version )"
call the method self.validate_key with argument key.,self . validate_key ( key )
"define the method delete with 3 arguments: self, key, and version set to None.","def delete ( self , key , version = None ) :"
"call the method self.make_key with key and version set to version as arguments, substitute it for key.","key = self . make_key ( key , version = version )"
call the method self.validate_key with argument key.,self . validate_key ( key )
"define the method get_many with 3 arguments: self, keys, and version set to None.","def get_many ( self , keys , version = None ) :"
return an empty dictionary.,return { }
"define the method has_key with 3 arguments: self, key, and version set to None.","def has_key ( self , key , version = None ) :"
"call the method self.make_key with key and version set to version as arguments, substitute it for key.","key = self . make_key ( key , version = version )"
call the method self.validate_key with argument key.,self . validate_key ( key )
return boolean False.,return False
"define the method set_many with 4 arguments: self, data, timeout set to DEFAULT_TIMEOUT and version set to None.","def set_many ( self , data , timeout = DEFAULT_TIMEOUT , version = None ) :"
do nothing,pass
"define the method delete_many with 3 arguments: self, keys, and version set to None.","def delete_many ( self , keys , version = None ) :"
do nothing.,pass
define the method clear with argument self.,def clear ( self ) :
do nothing.,pass
derive the class CacheClass from the DummyCache base class.,class CacheClass ( DummyCache ) :
do nothing.,pass
import module errno.,import errno
import module glob.,import glob
import module hashlib.,import hashlib
import module io.,import io
import module os.,import os
import module random.,import random
import module tempfile.,import tempfile
import module time.,import time
import module zlib.,import zlib
from django.core.cache.backends.base import BaseCache and DEFAULT_TIMEOUT into default name space.,"from django . core . cache . backends . base import BaseCache , DEFAULT_TIMEOUT"
from django.core.files.move import file_move_safe into default name space.,from django . core . files . move import file_move_safe
from django.utils.encoding import force_bytes into default name space.,from django . utils . encoding import force_bytes
"try,",try :
from django.utils.six.moves import cPickle as pickle into default name space.,from django . utils . six . moves import cPickle as pickle
"if ImportError exception is caught,",except ImportError :
import pickle.,import pickle
derive the class FileBasedCache from BaseCache base class.,class FileBasedCache ( BaseCache ) :
cache_suffix is a string '.djcache'.,cache_suffix = '.djcache'
"define the initialization method __init__ with arguments: self class instance, dir and params.","def __init__ ( self , dir , params ) :"
call method __init__ with argument params from the base class of the FileBaseCache.,"super ( FileBasedCache , self ) . __init__ ( params )"
"get absolute directory path of dir, substitute it for self._dir.",self . _dir = os . path . abspath ( dir )
call the self._createdir method.,self . _createdir ( )
"define the method add with 5 arguments, self class instance, key, value, timeout set to DEFAULT_TIMEOUT and version set to None.","def add ( self , key , value , timeout = DEFAULT_TIMEOUT , version = None ) :"
"evaluate method self.has_key with key and version as arguments, if the result is true,","if self . has_key ( key , version ) :"
return boolean False.,return False
"call the method self.set with key, value, timeout and version as arguments.","self . set ( key , value , timeout , version )"
return boolean True.,return True
"define the method get with 5 arguments, self class instance, key, default set to None and version set to None.","def get ( self , key , default = None , version = None ) :"
"call the function self._key_to_file with key and version as arguments, substitute it for fname.","fname = self . _key_to_file ( key , version )"
"if fname file path exists,",if os . path . exists ( fname ) :
"try,",try :
"with return value of the function io.open with fname and string 'rb' as arguments, named as f,","with io . open ( fname , 'rb' ) as f :"
"evaluate self._is_expired method with f as argument, if the result is false,",if not self . _is_expired ( f ) :
"call f.read function, use the result as the argument for zlib.decompress function call, call the pickle.loads function with the previous result as argument, return the result.",return pickle . loads ( zlib . decompress ( f . read ( ) ) )
"if IOError, renamed to e, exception is caught,",except IOError as e :
"if e.errno equals to errno.ENOENT,",if e . errno == errno . ENOENT :
do nothing.,pass
return default.,return default
"define the method set with 5 arguments, self class instance, key, value, timeout set to DEFAULT_TIMEOUT and version set to None.","def set ( self , key , value , timeout = DEFAULT_TIMEOUT , version = None ) :"
call the self._createdir method.,self . _createdir ( )
"call the function self._key_to_file with key and version as arguments, substitute it for fname.","fname = self . _key_to_file ( key , version )"
call the method self._cull.,self . _cull ( )
"call the method tempfile.mkstemp with dir set to self._dir, substitute result for fd and tmp_path, respectively.","fd , tmp_path = tempfile . mkstemp ( dir = self . _dir )"
renamed is boolean False.,renamed = False
"try,",try :
"with return value of the function io.open with fname and string 'rb' as arguments, named as f,","with io . open ( fd , 'wb' ) as f :"
"call the method self.get_backend_timeout with argument timeout, substitute it for expiry.",expiry = self . get_backend_timeout ( timeout )
"call the function pickle.dumps with expiry and integer -1 as arguments, use the result as the argument for the call to f.write function.","f . write ( pickle . dumps ( expiry , - 1 ) )"
"call the function pickle.dumps with argument value, use the result and integer -1 as arguments for the call to the function zlib.compress, use the result as an argument for the call to the f.write method.","f . write ( zlib . compress ( pickle . dumps ( value ) , - 1 ) )"
"call the function file_move_safe with tmp_path, fname, allow_overwrite set to boolean True as arguments.","file_move_safe ( tmp_path , fname , allow_overwrite = True )"
renamed is boolean True.,renamed = True
"finally perform,",finally :
"if renamed is boolean False,",if not renamed :
remove file tmp_path.,os . remove ( tmp_path )
"define the method delete with self class instance, key and version defaulting to None as arguments.","def delete ( self , key , version = None ) :"
"call the function self._key_to_file with key and version as arguments, use the result as an argument for the call to the self._delete method.","self . _delete ( self . _key_to_file ( key , version ) )"
define the method _delete with self and fname as arguments.,"def _delete ( self , fname ) :"
"if fname doesnt start with self._dir and fname file path doesnt exists,",if not fname . startswith ( self . _dir ) or not os . path . exists ( fname ) :
return nothing.,return
"try,",try :
call the function os.remove with argument fname.,os . remove ( fname )
"if exception OSError, renamed to e, is caught,",except OSError as e :
"if e.errno does not equals to errno.ENOENT,",if e . errno != errno . ENOENT :
raise an exception.,raise
"define the method has_key with self class instance, key and version defaulting to None as arguments.","def has_key ( self , key , version = None ) :"
"call the function self._key_to_file with key and version as arguments, substitute it for fname.","fname = self . _key_to_file ( key , version )"
"if fname file path exists,",if os . path . exists ( fname ) :
"with call to the io.open function with fname and string 'rb' as arguments, renamed to f,","with io . open ( fname , 'rb' ) as f :"
"call the method self._is_expired with argument f, invert the boolean result and return it.",return not self . _is_expired ( f )
return boolean False.,return False
define the method _cull with argument self.,def _cull ( self ) :
"call the self._list_cache_files method, substitute the result for filelist.",filelist = self . _list_cache_files ( )
num_entries is length of filelist.,num_entries = len ( filelist )
"if num_entries is lesser than self._max_entries,",if num_entries < self . _max_entries :
return nothing.,return
if self._cull_frequency equals to integer 0.,if self . _cull_frequency == 0 :
evaluate self.clear method and return the result.,return self . clear ( )
"divide num_entries by self._cull_frequency, convert the result to an integer, call the random.sample function with filelist and previous result as arguments, substitute the result for filelist.","filelist = random . sample ( filelist , int ( num_entries / self . _cull_frequency ) )"
"for every fname in filelist,",for fname in filelist :
call self._delete method with argument fname.,self . _delete ( fname )
define the method _createdir with argument self.,def _createdir ( self ) :
"if self._dir path doesnt exists,",if not os . path . exists ( self . _dir ) :
"try,",try :
call os.makedirs function with self._dir and hexadecimal 0o700 as arguments.,"os . makedirs ( self . _dir , 0o700 )"
"if OSError, renamed to e, exception is caught,",except OSError as e :
"if e.errno is not equal to errno.EEXIST,",if e . errno != errno . EEXIST :
"raise an EnvironmentError exception with string ""Cache directory '%s' does not exist and could not be created"" as argument,","raise EnvironmentError ( ""Cache directory '%s' does not exist "" ""and could not be created'"" % self . _dir )"
